{
  "call_id": "swz_MUL0283",
  "source": "spokenwoz",
  "language": "en",
  "stress_profile": "clean",
  "workflow_type": "profile+restaurant+train",
  "turns": [
    {
      "turn_id": "t1",
      "speaker": "user",
      "text": "i am traveling and have encounter some difficulties .",
      "start_ms": 2310,
      "end_ms": 5070
    },
    {
      "turn_id": "t2",
      "speaker": "agent",
      "text": "okay , please tell me your needs and i will try my best to help you .",
      "start_ms": 5420,
      "end_ms": 7610
    },
    {
      "turn_id": "t3",
      "speaker": "user",
      "text": "okay .  so .  uh .",
      "start_ms": 7570,
      "end_ms": 12088
    },
    {
      "turn_id": "t4",
      "speaker": "agent",
      "text": "what other information do you want .",
      "start_ms": 12210,
      "end_ms": 16669
    },
    {
      "turn_id": "t5",
      "speaker": "user",
      "text": "i am looking for a place to die .",
      "start_ms": 16790,
      "end_ms": 19170
    },
    {
      "turn_id": "t6",
      "speaker": "agent",
      "text": "okay . so what's your request .",
      "start_ms": 19240,
      "end_ms": 24060
    },
    {
      "turn_id": "t7",
      "speaker": "user",
      "text": "okay . so in what is the price of the restaurant .",
      "start_ms": 24630,
      "end_ms": 28520
    },
    {
      "turn_id": "t8",
      "speaker": "agent",
      "text": "it is cheap .",
      "start_ms": 28550,
      "end_ms": 30720
    },
    {
      "turn_id": "t9",
      "speaker": "user",
      "text": "hello . is this customer service .",
      "start_ms": 31390,
      "end_ms": 36739
    },
    {
      "turn_id": "t10",
      "speaker": "agent",
      "text": "yes . what can i help you .",
      "start_ms": 36900,
      "end_ms": 42150
    },
    {
      "turn_id": "t11",
      "speaker": "user",
      "text": "i'm looking for train .",
      "start_ms": 43080,
      "end_ms": 44490
    },
    {
      "turn_id": "t12",
      "speaker": "agent",
      "text": "okay . what about the information or your request .",
      "start_ms": 49130,
      "end_ms": 57310
    },
    {
      "turn_id": "t13",
      "speaker": "user",
      "text": "and the train is bound bound for cambridge .",
      "start_ms": 58010,
      "end_ms": 60010
    },
    {
      "turn_id": "t14",
      "speaker": "agent",
      "text": "okay , i understand .",
      "start_ms": 60740,
      "end_ms": 69469
    },
    {
      "turn_id": "t15",
      "speaker": "user",
      "text": "uh , and this train leaves after 1240 .",
      "start_ms": 71559,
      "end_ms": 76950
    },
    {
      "turn_id": "t16",
      "speaker": "agent",
      "text": "okay . and what about the departure spot .",
      "start_ms": 77370,
      "end_ms": 82379
    },
    {
      "turn_id": "t17",
      "speaker": "user",
      "text": "and the train should depart from broccoli burn on monday .",
      "start_ms": 83453,
      "end_ms": 85869
    },
    {
      "turn_id": "t18",
      "speaker": "agent",
      "text": "broxbourne . so here is a train will leave at 12:45 and it will be the best choice for you .",
      "start_ms": 86480,
      "end_ms": 91167
    },
    {
      "turn_id": "t19",
      "speaker": "user",
      "text": "ah yes , it's okay .",
      "start_ms": 91830,
      "end_ms": 93260
    },
    {
      "turn_id": "t20",
      "speaker": "agent",
      "text": "okay . and . this train will . arrive at . 20:32 .",
      "start_ms": 96370,
      "end_ms": 98946
    },
    {
      "turn_id": "t21",
      "speaker": "user",
      "text": "uh .  okay . uh , and i'd like to ask about the travel time of the train .",
      "start_ms": 99420,
      "end_ms": 102550
    },
    {
      "turn_id": "t22",
      "speaker": "agent",
      "text": "okay , the travel time of the train is 16 minutes .",
      "start_ms": 102830,
      "end_ms": 106670
    },
    {
      "turn_id": "t23",
      "speaker": "user",
      "text": "uh , and what train id .",
      "start_ms": 107390,
      "end_ms": 108870
    },
    {
      "turn_id": "t24",
      "speaker": "agent",
      "text": "the idea of the train is tr9083 .",
      "start_ms": 109290,
      "end_ms": 111166
    },
    {
      "turn_id": "t25",
      "speaker": "user",
      "text": "uh , what is the price of the train .",
      "start_ms": 111530,
      "end_ms": 114860
    },
    {
      "turn_id": "t26",
      "speaker": "agent",
      "text": "the price of the train is 17.90 .",
      "start_ms": 115730,
      "end_ms": 118236
    },
    {
      "turn_id": "t27",
      "speaker": "user",
      "text": "okay , thanks .",
      "start_ms": 119290,
      "end_ms": 125380
    },
    {
      "turn_id": "t28",
      "speaker": "agent",
      "text": "what else can i help you .",
      "start_ms": 125480,
      "end_ms": 127390
    },
    {
      "turn_id": "t29",
      "speaker": "user",
      "text": "uh , because i'm mexican and i want to eat some hometown food .",
      "start_ms": 128880,
      "end_ms": 133625
    },
    {
      "turn_id": "t30",
      "speaker": "agent",
      "text": "okay , i understand .",
      "start_ms": 134170,
      "end_ms": 138880
    },
    {
      "turn_id": "t31",
      "speaker": "user",
      "text": "and the location of the restaurant should be in the center of the city .",
      "start_ms": 139520,
      "end_ms": 144448
    },
    {
      "turn_id": "t32",
      "speaker": "agent",
      "text": "um so sorry . here is no match for your request .",
      "start_ms": 144910,
      "end_ms": 149180
    },
    {
      "turn_id": "t33",
      "speaker": "user",
      "text": "well , is there a place that serves indian food .",
      "start_ms": 149760,
      "end_ms": 153540
    },
    {
      "turn_id": "t34",
      "speaker": "agent",
      "text": "yes . kohinoor will be the best choice for you .",
      "start_ms": 154040,
      "end_ms": 160139
    },
    {
      "turn_id": "t35",
      "speaker": "user",
      "text": "great . what is the address of the restaurant .",
      "start_ms": 160940,
      "end_ms": 165170
    },
    {
      "turn_id": "t36",
      "speaker": "agent",
      "text": "the address is . centre .",
      "start_ms": 165390,
      "end_ms": 166920
    },
    {
      "turn_id": "t37",
      "speaker": "user",
      "text": "thank you very much .",
      "start_ms": 167930,
      "end_ms": 169860
    },
    {
      "turn_id": "t38",
      "speaker": "agent",
      "text": "you are welcome .",
      "start_ms": 169860,
      "end_ms": 171220
    },
    {
      "turn_id": "t39",
      "speaker": "user",
      "text": "uh , bi .",
      "start_ms": 171970,
      "end_ms": 173870
    },
    {
      "turn_id": "t40",
      "speaker": "agent",
      "text": "bye .",
      "start_ms": 174050,
      "end_ms": 175220
    }
  ],
  "audio_path": null,
  "metadata": {
    "license": "CC BY-NC 4.0 (eval use)",
    "speaker_source": "tag field (channel ids do not separate speakers)",
    "skipped_unwordtimed_turns": 0,
    "n_plausible_overlaps": 0,
    "n_long_intra_pauses": 0,
    "goal": {
      "profile": {
        "info": {}
      },
      "restaurant": {
        "info": {
          "food": "indian"
        },
        "reqt": [
          "address",
          "pricerange"
        ]
      },
      "train": {
        "info": {
          "departure": "broxbourne",
          "leaveAt": "12:45"
        },
        "reqt": [
          "duration",
          "trainID",
          "price"
        ]
      }
    },
    "selection_bucket": "clean_laggy"
  }
}