{
  "call_id": "cmd_hi_0022",
  "source": "code_mixed_dialog",
  "language": "hi-en",
  "stress_profile": "unmeasured",
  "workflow_type": "restaurant_reservation",
  "turns": [
    {
      "turn_id": "t1",
      "speaker": "agent",
      "text": "Hello , Cambridge restaurant system mein aapka swagat hai . Aap pa sakte hai restaurant by area , price range ya food type . Aap ko kaise help kar sakta hu main ?",
      "start_ms": null,
      "end_ms": null
    },
    {
      "turn_id": "t2",
      "speaker": "user",
      "text": "mein center mein ek restaurant dundh raha hun jo corsia food serve karta ho .",
      "start_ms": null,
      "end_ms": null
    },
    {
      "turn_id": "t3",
      "speaker": "agent",
      "text": "Sorry centre of town mai koi corsica restaurant nahi hai",
      "start_ms": null,
      "end_ms": null
    },
    {
      "turn_id": "t4",
      "speaker": "user",
      "text": "north_american kaisa rahega",
      "start_ms": null,
      "end_ms": null
    },
    {
      "turn_id": "t5",
      "speaker": "agent",
      "text": "aap restaurant dhund rahe hai na ?",
      "start_ms": null,
      "end_ms": null
    },
    {
      "turn_id": "t6",
      "speaker": "user",
      "text": "north_american type ke khaane ke baare me kya khayal hai",
      "start_ms": null,
      "end_ms": null
    },
    {
      "turn_id": "t7",
      "speaker": "agent",
      "text": "Sorry centre of town mai koi corsica restaurant nahi hai",
      "start_ms": null,
      "end_ms": null
    },
    {
      "turn_id": "t8",
      "speaker": "user",
      "text": "north_american type ke khaane ke baare me kya khayal hai",
      "start_ms": null,
      "end_ms": null
    },
    {
      "turn_id": "t9",
      "speaker": "agent",
      "text": "gourmet_burger_kitchen ek achha restaurant hai nagar ke centre bhaag mein jo north_american khana serve karta hai",
      "start_ms": null,
      "end_ms": null
    },
    {
      "turn_id": "t10",
      "speaker": "user",
      "text": "phone number kya hain",
      "start_ms": null,
      "end_ms": null
    },
    {
      "turn_id": "t11",
      "speaker": "agent",
      "text": "gourmet_burger_kitchen ka phone number hai gourmet_burger_kitchen_phone",
      "start_ms": null,
      "end_ms": null
    },
    {
      "turn_id": "t12",
      "speaker": "user",
      "text": "Thank you , good bye .",
      "start_ms": null,
      "end_ms": null
    },
    {
      "turn_id": "t13",
      "speaker": "agent",
      "text": "Welcome , alvida",
      "start_ms": null,
      "end_ms": null
    }
  ],
  "audio_path": null,
  "metadata": {
    "timing_observed": false,
    "source_dataset": "Code-Mixed-Dialog",
    "source_repo": "https://github.com/sumanbanerjee1/Code-Mixed-Dialog",
    "source_commit": "9df1d4dc800548a883f8bc1a9ce4116c77aebc02",
    "source_split": "dev",
    "source_dialog_index": 22,
    "license": "Apache-2.0 (repo LICENSE); CC BY 4.0 on the arXiv paper",
    "translation_status": "translated (human, from English DSTC2)",
    "domain": "DSTC2 restaurant reservation",
    "utterance_turns": 13,
    "selection_rule": "deterministic file-order; 4<=utterance_turns<=20; deduped by transcript"
  }
}
